<?xml version='1.0' encoding='UTF-8'?>
<scenario xmlns="https://dueca.tudelft.nl/testscenario" xmlns:xsi="http://www.w3.org/2001/XMLSchema-instance" xsi:schemaLocation="https://dueca.tudelft.nl/testscenario https://dueca.tudelft.nl/schemas/testscenario.xsd">
  <!-- scenario description

    This uses the SimpleSimulation project, which creates a single player.

    To recreate:

    - Calibrate offset, mouse to upper left corner of a window, press F3
    - Operate DUECA/DUSIME state machine to advance
    - Click once to the right, once to the left, in stick window
      - Take a snapshot
    - Operate to off and exit
  -->
  <project name="SimpleSimulation">
    <window>DUECA/DUSIME control panel</window>
    <window>Are you serious?</window>
    <window>HID GUI</window>
    <window>front</window>
  </project>
  <repository>https://github.com/dueca/</repository>
  <buildoptions>-DUSE_GTK3=ON</buildoptions>
  <execute>
    <platform>simlab</platform>
    <node>host</node>
  </execute>
  <execute>
    <platform>simlab</platform>
    <node>igtest</node>
  </execute>
  <offset x="0" y="17" criterion="0.995"/>
  <actions>
    <!-- hold -->
    <!-- calibrate -->
    <check-image window="DUECA/DUSIME control panel" x="461" y="56" template="buttongreensel" testsize="48" timeout="40.0" wait="0.5"/>
    <check-image window="DUECA/DUSIME control panel" x="463" y="92" template="buttongraysel" testsize="48" timeout="10.0" wait="0.5"/>
    <click x="-1" y="-2" relative="true" button="Button.left" pressed="true" wait="0.2"/>
    <click x="-1" y="-2" relative="true" button="Button.left" pressed="false" wait="0.2"/>
    <check-image window="DUECA/DUSIME control panel" x="463" y="92" template="buttongreensel" testsize="48" timeout="20.0" wait="0.5"/>
    <check-image window="DUECA/DUSIME control panel" x="464" y="126" template="buttongraysel" testsize="48" timeout="10.0" wait="0.5"/>
    <click x="0" y="-2" relative="true" button="Button.left" pressed="true" wait="0.2"/>
    <click x="0" y="-2" relative="true" button="Button.left" pressed="false" wait="0.2"/>
    <check-image window="DUECA/DUSIME control panel" x="464" y="126" template="buttongreensel" testsize="48" timeout="20.0" wait="0.5"/>
    <check-image window="DUECA/DUSIME control panel" x="462" y="159" template="buttongreensel" testsize="48" timeout="10.0" wait="0.5"/>
    <check-image window="DUECA/DUSIME control panel" x="464" y="196" template="buttongraysel" testsize="48" timeout="10.0" wait="0.5"/>
    <click x="0" y="0" relative="true" button="Button.left" pressed="true" wait="0.2"/>
    <click x="0" y="0" relative="true" button="Button.left" pressed="false" wait="0.2"/>
    <check-image window="DUECA/DUSIME control panel" x="419" y="193" template="buttongraysel" testsize="48" timeout="10.0" wait="0.5"/>
    <click x="-1" y="-3" relative="true" button="Button.left" pressed="true" wait="0.2"/>
    <click x="-1" y="-3" relative="true" button="Button.left" pressed="false" wait="0.2"/>
    <check-image window="DUECA/DUSIME control panel" x="463" y="194" template="buttongreensel" testsize="48" timeout="10.0" wait="0.5"/>
    <check-image window="DUECA/DUSIME control panel" x="462" y="230" template="buttongraysel" testsize="48" timeout="10.0" wait="0.5"/>
    <click x="-2" y="0" relative="true" button="Button.left" pressed="true" wait="0.2"/>
    <click x="-2" y="0" relative="true" button="Button.left" pressed="false" wait="0.2"/>
    <check-color window="HID GUI" x="143" y="100" r="246" g="245" b="244" timeout="10.0" wait="0.5"/>
    <click x="0" y="0" relative="true" button="Button.left" pressed="true" wait="0.2"/>
    <click x="0" y="0" relative="true" button="Button.left" pressed="false" wait="0.2"/>
    <check-color window="HID GUI" x="47" y="98" r="246" g="245" b="244" timeout="10.0" wait="2.5"/>
    <snap name="simplesimulation000.png"/>
    <click x="0" y="0" relative="true" button="Button.left" pressed="true" wait="0.2"/>
    <click x="0" y="0" relative="true" button="Button.left" pressed="false" wait="0.2"/>
    <check-color window="HID GUI" x="145" y="98" r="246" g="245" b="244" timeout="10.0" wait="2.5"/>
    <click x="0" y="0" relative="true" button="Button.left" pressed="true" wait="0.2"/>
    <click x="0" y="0" relative="true" button="Button.left" pressed="false" wait="0.2"/>
    <check-color window="HID GUI" x="46" y="98" r="246" g="245" b="244" timeout="10.0" wait="2.5"/>
    <click x="0" y="0" relative="true" button="Button.left" pressed="true" wait="0.2"/>
    <click x="0" y="0" relative="true" button="Button.left" pressed="false" wait="0.2"/>
    <check-image window="DUECA/DUSIME control panel" x="468" y="194" template="buttongraysel" testsize="48" timeout="10.0" wait="0.5"/>
    <click x="4" y="-2" relative="true" button="Button.left" pressed="true" wait="0.2"/>
    <click x="4" y="-2" relative="true" button="Button.left" pressed="false" wait="0.2"/>
    <check-image window="DUECA/DUSIME control panel" x="464" y="162" template="buttongraysel" testsize="48" timeout="10.0" wait="0.5"/>
    <click x="0" y="0" relative="true" button="Button.left" pressed="true" wait="0.2"/>
    <click x="0" y="0" relative="true" button="Button.left" pressed="false" wait="0.2"/>
    <check-image window="DUECA/DUSIME control panel" x="466" y="91" template="buttongraysel" testsize="48" timeout="10.0" wait="0.5"/>
    <click x="2" y="-3" relative="true" button="Button.left" pressed="true" wait="0.2"/>
    <click x="2" y="-3" relative="true" button="Button.left" pressed="false" wait="0.2"/>
    <check-image window="DUECA/DUSIME control panel" x="465" y="59" template="buttongraysel" testsize="48" timeout="10.0" wait="0.5"/>
    <click x="1" y="-1" relative="true" button="Button.left" pressed="true" wait="0.2"/>
    <click x="1" y="-1" relative="true" button="Button.left" pressed="false" wait="0.2"/>
    <check-image window="DUECA/DUSIME control panel" x="465" y="59" template="buttongreensel" testsize="48" timeout="10.0" wait="0.5"/>
    <check-word window="DUECA/DUSIME control panel" x="14" y="11" word="File" testsize="64" timeout="10.0" wait="0.5"/>
    <click relative="true" x="-1" y="-1" button="Button.left" pressed="true" wait="0.3"/>
    <click relative="true" x="-1" y="-1" button="Button.left" pressed="false" wait="0.3"/>
    <check-image window="DUECA/DUSIME control panel" x="29" y="66" template="quit-blue" testsize="96" timeout="10.0" wait="0.5"/>
    <click relative="true" x="1" y="-1" button="Button.left" pressed="true" wait="0.3"/>
    <click relative="true" x="1" y="-1" button="Button.left" pressed="false" wait="0.3"/>
    <check-word window="Are you serious?" x="25" y="51" word="Yes," testsize="64" timeout="10.0" wait="0.5"/>
    <click relative="true" x="-2" y="-4" button="Button.left" pressed="true" wait="0.3"/>
    <click relative="true" x="-2" y="-4" button="Button.left" pressed="false" wait="0.3"/>
  </actions>
</scenario>
