<?xml version='1.0' encoding='UTF-8'?>
<scenario xmlns="https://dueca.tudelft.nl/testscenario" xmlns:xsi="http://www.w3.org/2001/XMLSchema-instance" xsi:schemaLocation="https://dueca.tudelft.nl/testscenario https://dueca.tudelft.nl/schemas/testscenario.xsd">
  <!-- scenario description

    This uses the DuecaTestCommunication project to check some triggering logic.

    To recreate:

    - Calibrate offset, mouse to upper left corner of a window, press F3
    - Operate DUECA/DUSIME state machine to work
    - modify the timing for the stop, to give the simulation time to run the
      code
    - operate to off and exit
  -->
  <project name="DuecaTestCommunication">
    <window>DUECA/DUSIME control panel</window>
    <window>Are you serious?</window>
    <window>Activity View</window>
  </project>
  <repository>https://github.com/dueca/</repository>
  <buildoptions>-DUSE_GTK3=ON</buildoptions>
  <execute>
    <platform>solo</platform>
    <node>triggering</node>
  </execute>
  <actions>
    <check-image window="DUECA/DUSIME control panel" x="461" y="41" template="buttongreensel" testsize="64" timeout="10.0" wait="0.5"/>
    <check-image window="DUECA/DUSIME control panel" x="463" y="75" template="buttongraysel" testsize="64" timeout="10.0" wait="0.5"/>
    <click x="-1" y="-2" relative="true" button="Button.left" pressed="true" wait="0.2"/>
    <click x="-1" y="-2" relative="true" button="Button.left" pressed="false" wait="0.2"/>
    <check-image window="DUECA/DUSIME control panel" x="463" y="75" template="buttongreensel" testsize="64" timeout="10.0" wait="0.5"/>
    <check-image window="DUECA/DUSIME control panel" x="465" y="109" template="buttongraysel" testsize="64" timeout="10.0" wait="0.5"/>
    <click x="1" y="-2" relative="true" button="Button.left" pressed="true" wait="0.2"/>
    <click x="1" y="-2" relative="true" button="Button.left" pressed="false" wait="0.2"/>
    <check-image window="DUECA/DUSIME control panel" x="465" y="109" template="buttongreensel" testsize="64" timeout="10.0" wait="20.5"/>
    <snap name="triggering000.png"/>
    <check-image window="DUECA/DUSIME control panel" x="463" y="75" template="buttongraysel" testsize="64" timeout="10.0" wait="0.5"/>
    <click x="-1" y="-2" relative="true" button="Button.left" pressed="true" wait="0.2"/>
    <click x="-1" y="-2" relative="true" button="Button.left" pressed="false" wait="0.2"/>
    <check-image window="DUECA/DUSIME control panel" x="463" y="75" template="buttongreensel" testsize="64" timeout="10.0" wait="0.5"/>
    <check-image window="DUECA/DUSIME control panel" x="463" y="39" template="buttongraysel" testsize="64" timeout="10.0" wait="0.5"/>
    <click x="-1" y="-4" relative="true" button="Button.left" pressed="true" wait="0.2"/>
    <click x="-1" y="-4" relative="true" button="Button.left" pressed="false" wait="0.2"/>
    <check-image window="DUECA/DUSIME control panel" x="463" y="39" template="buttongreensel" testsize="64" timeout="10.0" wait="0.5"/>
    <check-word window="DUECA/DUSIME control panel" x="14" y="11" word="File" testsize="64" timeout="10.0" wait="0.5"/>
    <click relative="true" x="-1" y="-1" button="Button.left" pressed="true" wait="0.3"/>
    <click relative="true" x="-1" y="-1" button="Button.left" pressed="false" wait="0.3"/>
    <check-image window="DUECA/DUSIME control panel" x="29" y="66" template="quit-blue" testsize="96" timeout="10.0" wait="0.5"/>
    <click relative="true" x="1" y="-1" button="Button.left" pressed="true" wait="0.3"/>
    <click relative="true" x="1" y="-1" button="Button.left" pressed="false" wait="0.3"/>
    <check-word window="Are you serious?" x="25" y="51" word="Yes," testsize="64" timeout="10.0" wait="0.5"/>
    <click relative="true" x="-2" y="-4" button="Button.left" pressed="true" wait="0.3"/>
    <click relative="true" x="-2" y="-4" button="Button.left" pressed="false" wait="0.3"/>
  </actions>
</scenario>
